{"schema_version":"0.2.0","run_id":"codex-codex-high-r1","campaign_id":"2026-07-15-codex-text-report-smoke","created_at":"2026-07-15T08:30:00.000Z","experiment":{"id":"codex-text-report-smoke","version":"1.0.0","spec_path":"experiments/codex-text-report-smoke/1.0.0.json","spec_digest":"sha256:956982b51f445b9a36d7f48dbf1448b1ad2e81b739e71d1cf1963b4460ca62dd"},"suite":{"id":"first-codex-slice","version":"1.0.0","spec_path":"suites/first-codex-slice/1.0.0.json","spec_digest":"sha256:8c2975691e3d6e81f258ccbbc094e597a7361c8dce609c37cd6c142ebc11d073"},"task":{"id":"python-text-report","version":"1.0.0","spec_path":"tasks/python-text-report/1.0.0/task.json","spec_digest":"sha256:ba07588ccda885076716e723341e309f9cacdcb7c674fba2d10f7b01849abcb6","prompt_digest":"sha256:3450b7930de33ed7d237166ecbe0337f86d456524a5746e4300c590e5a0d7291","initial_tree_digest":"tree-sha256-v1:90667322b1b4a7a98c017a2d5d1f0d7676d2746a4599d71adf0391ee40ea7258","evaluator_digest":"tree-sha256-v1:76247f28b811ca9dad3cf5bf5a9f31c59b7570bb30793b9ea89e55bad32199eb"},"repetition":1,"schedule_index":1,"attempt":{"number":1,"mode":"initial","initiated_by":"runner"},"workspace":{"path":"/workspace","prompt_path":"tasks/python-text-report/1.0.0/prompt.md","prompt_digest":"sha256:3450b7930de33ed7d237166ecbe0337f86d456524a5746e4300c590e5a0d7291","initial_tree_digest":"tree-sha256-v1:90667322b1b4a7a98c017a2d5d1f0d7676d2746a4599d71adf0391ee40ea7258"},"configuration":{"id":"codex-high","harness":{"family":"codex","interface":"cli-exec","adapter_id":"codex-cli","adapter_version":"0.1.0","runtime_version":"0.145.0-alpha.11","config":{"sandbox":"workspace-write","network":"task-policy","user_config":"ignored"}},"model":{"provider":"openai","requested_id":"gpt-5.6-sol"},"effort":{"display_label":"high","native_value":"high"},"limits":{"wall_time_seconds":{"value":480,"enforcement":"hard"},"total_tokens":{"value":80000,"enforcement":"observe-only"}}},"execution":{"mode":"host","isolation":"harness-sandbox","canonical":false,"credential_protection":"short-lived","environment_digest":"sha256:d8adda7e630111f76721e365af50e9413857ad378d401a0600cc3255ca7fca45","operating_system":"darwin","architecture":"arm64"},"network":{"mode":"disabled"},"invocation":{"runtime_source":"npm:@openai/codex","requested_runtime":"0.145.0-alpha.11","resolved_runtime_version":"0.145.0-alpha.11","runtime_digest":"sha256:134063e133f0b4244fa3b251acf973d4fe4b4aeeacbdc135211bf480f59f1477","executable_digest":"sha256:134063e133f0b4244fa3b251acf973d4fe4b4aeeacbdc135211bf480f59f1477","argv":["codex","exec","--json","--ephemeral","--ignore-user-config","--ignore-rules","--strict-config","--skip-git-repo-check","--sandbox","workspace-write","--cd","/workspace","--model","gpt-5.6-sol","--config","approval_policy=\"never\"","--config","model_reasoning_effort=\"high\"","--config","sandbox_workspace_write.network_access=false","-"],"working_directory":"/workspace","stdin_digest":"sha256:3450b7930de33ed7d237166ecbe0337f86d456524a5746e4300c590e5a0d7291","environment":[{"name":"LANG","classification":"public","source":"runner","value":"C.UTF-8"}],"secret_names":[],"full_access":false},"artifact_targets":{"request":"request.json","run_result":"run.json","native_events":"events.native.jsonl","stdout":"stdout.log","stderr":"stderr.log","final_message":"final-message.txt","workspace_patch":"workspace.patch","workspace_tree":"workspace-tree.json","evaluator_result":"evaluator.json"}}